{"id":"TASK-CULT-RECORDS-001","title":"Complete cultivation records accurately","description":"Record work, observations, measurements, plant or batch identity, deviations, and handoff information accurately and legibly.","competencies":["COMP-PRO-SOP-001","COMP-PRO-QA-001"],"proficiency":"PROF-OPERATIONAL-001","assessmentIdeas":["mock cultivation log","deviation documentation exercise"],"version":"1.0.0"}
