{"id":"TASK-CULT2-DIAG-001","title":"Diagnose routine crop-environment deviations","description":"Integrate plant observations, developmental stage, environmental history, irrigation context and recent work records to distinguish likely routine causes, identify missing evidence, and recommend verification or escalation steps.","competencies":["COMP-PLANT-BIO-001","COMP-ENV-ADV-001"],"proficiency":"PROF-DIAGNOSTIC-001","assessmentIdeas":["multi-factor crop deviation case","plant-environment differential diagnosis simulation"],"version":"1.0.0"}