{"id":"TASK-CULT-SAFETY-001","title":"Work safely in cultivation areas","description":"Recognize common workplace hazards, use required PPE, follow safe work practices, and escalate unsafe conditions.","competencies":["COMP-SAFETY-WORK-001"],"proficiency":"PROF-OPERATIONAL-001","safetyCritical":true,"assessmentIdeas":["hazard-identification scenario","PPE selection scenario","safe-work practical checklist"],"version":"1.0.0"}
